{
  "$schema": "https://json-schema.org/draft/2020-12/schema",
  "$id": "https://yoheinakajima.github.io/distributed-discovery/schemas/discoverybench-agents-action-v1.json",
  "title": "DiscoveryBench Agents visible action v1",
  "type": "object",
  "additionalProperties": false,
  "required": ["schema_version", "task_instance_commitment", "agent_id", "round", "final", "actions"],
  "properties": {
    "schema_version": {"const": "agents-action-v1"},
    "task_instance_commitment": {"type": "string", "pattern": "^sha256:[0-9a-f]{64}$"},
    "agent_id": {"type": "string", "pattern": "^AGENT-0[1-6]$"},
    "round": {"type": "integer", "minimum": 0, "maximum": 2},
    "final": {"type": "boolean"},
    "visible_message": {"type": "string", "maxLength": 1024},
    "source_choice": {"enum": ["common", "independent", "none"]},
    "actions": {
      "type": "array",
      "minItems": 1,
      "maxItems": 6,
      "uniqueItems": true,
      "description": "One to six proposal candidates when final is false; exactly one action when final is true.",
      "items": {"type": "string", "pattern": "^TARGET-[A-Z]$"}
    },
    "declared_confidence": {"type": "number", "minimum": 0, "maximum": 1},
    "declared_metadata": {
      "type": "object",
      "description": "Machine-readable agent-declared metadata; evaluator and hidden-answer fields remain prohibited.",
      "additionalProperties": true
    }
  },
  "allOf": [
    {
      "if": {
        "properties": {"final": {"const": true}},
        "required": ["final"]
      },
      "then": {
        "properties": {
          "actions": {"minItems": 1, "maxItems": 1}
        }
      }
    }
  ]
}
